{
    "$schema": "../../src/schemas/draft/2022-07/cnccodes.schema.json",
    "type": "mcode",
    "machineType": "mill",
    "title": "M Code Milling Reference",
    "description": "M Code Reference for Milling Machine Tools",
    "keywords": ["mazak", "mill", "milling"],
    "codes": {
        "M00": {
            "category": "mcode",
            "shortDesc": "Program Stop",
            "desc": "Program Stop"
        }
    }
}
