{
    "$schema": "../../src/schema/cnccodes.schema.json",
    "type": "mcode",
    "machineType": "mill",
    "title": "M Code Milling Reference",
    "description": "M Code Reference for Milling Machine Tools",
    "codes": {
        "M00": {
            "category": "mcode",
            "shortDesc": "Program Stop",
            "desc": "Program Stop"
        }
    }
}